Top queries,Clicks,Impressions,CTR,Position
best fall wedding guest dresses 2026 long sleeve but still sexy,0,36,0%,3.94
summer wedding guest dresses,0,21,0%,83
formal dresses for weddings,0,21,0%,90.24
indian wedding guest dresses,0,19,0%,52.42
semi formal dresses for wedding,0,18,0%,86.11
dressy casual wedding attire,0,14,0%,75.36
casual wedding outfits,0,13,0%,72.46
casual wedding attire for women,0,12,0%,71.42
indian wedding dresses for guests,0,11,0%,57.09
dressy casual wedding,0,10,0%,65.6
formal wedding guest dresses,0,9,0%,76.22
wedding guest cocktail dresses,0,9,0%,76.44
formal wedding attire women,0,9,0%,82
brown wedding guest dress,0,8,0%,89.25
casual dresses for wedding,0,7,0%,69.14
black wedding guest dress,0,7,0%,75
formal wedding dresses,0,7,0%,76.57
summer dresses for weddings,0,7,0%,79.29
elegant black dresses for wedding guests,0,7,0%,80.14
blush wedding guest dress,0,7,0%,84.14
black wedding guest dresses,0,7,0%,85.43
black cocktail dress for wedding,0,7,0%,86.57
cocktail dresses for wedding guest,0,7,0%,92.57
wedding guest dresses summer,0,6,0%,67.5
elegant black dresses for wedding guests with sleeves,0,6,0%,70.17
cocktail dresses for weddings,0,6,0%,79.17
elegant dresses for wedding,0,6,0%,79.33
hot pink dress for wedding guest,0,5,0%,72.8
bright pink wedding guest dress,0,5,0%,77
summer wedding guest dress,0,5,0%,92
desi wedding guest dresses,0,4,0%,51.5
indian dresses for wedding guest,0,4,0%,62.25
flowy summer wedding guest dress,0,4,0%,67.5
hot pink wedding guest dress,0,4,0%,67.5
womens formal wedding attire,0,4,0%,68.25
summer wedding guest dress 2026,0,4,0%,68.75
yellow wedding guest dress,0,4,0%,70.5
blush dresses for wedding guest,0,4,0%,73.5
black dress for wedding,0,4,0%,75.5
cocktail dresses for wedding,0,4,0%,76.75
what to wear to a casual wedding,0,4,0%,77
casual wedding attire for guests,0,4,0%,81
formal dress for wedding,0,4,0%,83.75
wedding guest cocktail dress,0,4,0%,91.25
wedding casual dress,0,4,0%,92.25
indian dress wedding guest,0,3,0%,43.67
wedding guest dress indian,0,3,0%,45
indian dress for wedding guest,0,3,0%,48.67
indian wedding dresses guest,0,3,0%,48.67
indian dresses for wedding guests,0,3,0%,50.67
wedding dresses for guests indian,0,3,0%,51.67
fuchsia wedding guest dress,0,3,0%,62.33
black dresses for weddings,0,3,0%,64.67
brown dresses for wedding guest,0,3,0%,65.33
casual wedding clothing,0,3,0%,67
wedding guest dress summer,0,3,0%,69
black fall wedding guest dress,0,3,0%,71
dressy casual wedding guest dress,0,3,0%,71.33
pink formal wedding guest dress,0,3,0%,72.67
casual wear for wedding party,0,3,0%,73
black cocktail dress for wedding guest,0,3,0%,76.33
black dress wedding guest outfit,0,3,0%,76.33
dresses formal wedding,0,3,0%,76.33
formal dress for wedding guest,0,3,0%,77.33
cocktail wedding guest dress,0,3,0%,80
black dresses for wedding,0,3,0%,81
semi formal dresses for wedding guest,0,3,0%,81.67
summer 2025 wedding guest dresses,0,3,0%,82
semi formal wedding guest dresses,0,3,0%,82.67
semi formal wedding gowns,0,3,0%,85
women's dresses for summer weddings,0,3,0%,87.67
sundress wedding guest dress,0,3,0%,89.67
cocktail dresses to wear to a wedding,0,3,0%,91.33
women's cocktail wedding guest dress,0,3,0%,92.33
black guest wedding dresses,0,3,0%,98.33
wedding guest dresses indian,0,2,0%,46
indian dresses wedding guest,0,2,0%,46.5
guest dress for indian wedding,0,2,0%,60.5
dresses for wedding guest indian,0,2,0%,62
light brown wedding guest dress,0,2,0%,62.5
casual dress for wedding,0,2,0%,65.5
women's black dress wedding guest,0,2,0%,66
all black wedding guest,0,2,0%,67.5
blush pink wedding guest dress,0,2,0%,67.5
fuchsia dress for wedding guest,0,2,0%,69.5
formal dresses for wedding,0,2,0%,70.5
summer dress for wedding,0,2,0%,71.5
black cocktail wedding guest dress,0,2,0%,72.5
blush colored dresses for wedding guest,0,2,0%,73.5
best summer wedding dresses,0,2,0%,74
black formal wedding guest dresses,0,2,0%,74.5
casual dresses for wedding guest,0,2,0%,75
formal dresses for wedding guest,0,2,0%,76.5
elegant pink dresses for wedding guests,0,2,0%,78
wedding guest outfit black,0,2,0%,78
butter yellow wedding dress,0,2,0%,79
best black dresses for wedding guest,0,2,0%,80
dress for casual wedding,0,2,0%,82
elegant wedding attire,0,2,0%,82.5
long black wedding guest dresses,0,2,0%,86.5
semi formal cocktail dress for wedding,0,2,0%,86.5
black dress for evening wedding,0,2,0%,87
casual wedding guest,0,2,0%,87
black cocktail dress wedding,0,2,0%,87.5
summer wedding guest dresses 2026,0,2,0%,87.5
summertime wedding guest dresses,0,2,0%,88
casual wedding guest dress,0,2,0%,88.5
cocktail dresses for weddings guest,0,2,0%,88.5
black dress as wedding guest,0,2,0%,91.5
black dresses wedding guest,0,2,0%,96.5
formal wedding dresses for guests,0,2,0%,97.5
designer cocktail dresses for weddings,0,2,0%,98
wedding guest dresses for summer,0,2,0%,100.5
pink dress wedding guest,0,1,0%,1
best fall wedding guest dresses 2026 long sleeve sexy,0,1,0%,11
long sleeve wedding guest,0,1,0%,11
modest wedding guest dresses 2026 trendy,0,1,0%,19
formal indian wedding guest dresses,0,1,0%,35
indian inspired wedding guest dresses,0,1,0%,42
dressy casual for wedding,0,1,0%,44
2026 wedding guest dresses,0,1,0%,45
dressy casual wedding attire women,0,1,0%,46
indian inspired dress for wedding guest,0,1,0%,46
semi formal cocktail wedding guest dress,0,1,0%,46
indian wedding reception dress for guest,0,1,0%,47
brown maxi wedding guest dress,0,1,0%,48
indian inspired wedding guest outfits,0,1,0%,48
dressy casual wedding attire for women,0,1,0%,49
indian wedding dress guest,0,1,0%,49
all black wedding guest outfit,0,1,0%,50
black dresses for wedding guest,0,1,0%,51
black dresses for wedding party,0,1,0%,53
summer 2026 wedding guest dresses,0,1,0%,53
wedding guest dresses cocktail attire,0,1,0%,53
women's black dresses for wedding,0,1,0%,53
casual wedding outfit women,0,1,0%,54
indian reception dress for guest,0,1,0%,55
summer wedding guest dresses 2025,0,1,0%,55
best wedding guest dresses 2026,0,1,0%,56
casual wedding guest dresses,0,1,0%,56
casual wedding guest outfit,0,1,0%,56
black cocktail dress wedding guest,0,1,0%,57
black wedding dress guest,0,1,0%,57
lightweight summer wedding guest dress,0,1,0%,57
simple indian wedding guest dresses,0,1,0%,57
black dresses to wear to a wedding,0,1,0%,58
cocktail formal wedding guest dress,0,1,0%,58
wedding guest black dress,0,1,0%,58
beautiful black dresses for wedding,0,1,0%,59
best semi formal dresses,0,1,0%,59
black wedding guest dress with sleeves,0,1,0%,59
casual dresses for weddings,0,1,0%,59
indian guest wedding dresses,0,1,0%,59
black strapless wedding guest dress,0,1,0%,61
dressy casual women wedding,0,1,0%,61
women brown wedding guest dress,0,1,0%,61
black formal dresses wedding guest,0,1,0%,62
black wedding guest dress winter,0,1,0%,62
ladies casual wedding outfits,0,1,0%,62
wedding guest dresses summer 2026,0,1,0%,62
best cocktail dresses 2025,0,1,0%,63
casual wedding wear women,0,1,0%,63
casual womens wedding attire,0,1,0%,63
indian wedding dress for guests,0,1,0%,63
sleeves black wedding guest dress,0,1,0%,63
elegant attire wedding,0,1,0%,64
blush color dress for wedding guest,0,1,0%,65
trendy wedding guest dresses 2025,0,1,0%,65
yellow summer wedding guest dress,0,1,0%,65
black cocktail dresses for wedding guest,0,1,0%,66
casual wedding attire,0,1,0%,66
semi formal wedding dresses,0,1,0%,67
summer wedding reception dresses,0,1,0%,67
women's black dress for wedding guest,0,1,0%,67
women's formal wedding guest attire,0,1,0%,67
casual wedding guest attire,0,1,0%,68
black satin wedding guest dress,0,1,0%,69
indian outfits for wedding guests,0,1,0%,69
summer chic wedding guest dress,0,1,0%,69
summer guest wedding dresses,0,1,0%,69
wedding dresses guest black,0,1,0%,69
wedding guest dresses butter yellow,0,1,0%,69
black cocktail dresses for wedding,0,1,0%,70
black evening wedding dress,0,1,0%,70
formal wear wedding guest,0,1,0%,70
summer elegant wedding guest dresses,0,1,0%,70
wedding dress guest black,0,1,0%,70
elegant formal wedding guest dresses,0,1,0%,71
formal cocktail wedding guest dress,0,1,0%,71
indian dresses for women wedding,0,1,0%,71
semi formal wedding gown,0,1,0%,72
summer wedding dresses,0,1,0%,72
wedding guest black,0,1,0%,72
wedding guest casual,0,1,0%,72
classy summer wedding guest dresses,0,1,0%,73
what to wear to casual wedding,0,1,0%,73
casual outfits for a wedding,0,1,0%,75
casual wedding outfits women,0,1,0%,75
cocktail dress for wedding,0,1,0%,75
formal wedding dress,0,1,0%,75
summer dresses wedding guest,0,1,0%,75
dress wedding formal,0,1,0%,76
evening formal wedding guest dresses,0,1,0%,76
wedding dress cocktail,0,1,0%,76
black dresses for evening wedding,0,1,0%,77
blush pink dresses for wedding guest,0,1,0%,77
casual dresses to wear to a wedding,0,1,0%,77
formal wedding guest attire,0,1,0%,77
wedding guests cocktail dresses,0,1,0%,77
best black dress for wedding guest,0,1,0%,78
formal dresses for women wedding,0,1,0%,78
formal guest wedding attire,0,1,0%,78
women's summer dresses for weddings,0,1,0%,78
casual dress for wedding reception,0,1,0%,79
hot pink dress wedding guest,0,1,0%,79
black dresses for women wedding guest,0,1,0%,80
formal dresses wedding guest,0,1,0%,80
what is dressy casual wedding attire,0,1,0%,80
women's dresses for a summer wedding,0,1,0%,80
womens black dress for wedding guest,0,1,0%,80
all black wedding guest dress,0,1,0%,81
casual dress to wear to a wedding,0,1,0%,81
semi formal dresses for wedding guests,0,1,0%,81
wedding guest formal,0,1,0%,81
black dress for summer wedding,0,1,0%,82
casual clothing for wedding,0,1,0%,82
dress for formal wedding reception,0,1,0%,82
formal attire wedding guest dress,0,1,0%,82
pink dresses for wedding guests,0,1,0%,82
wedding guest dress brown,0,1,0%,82
black maxi wedding guest dress,0,1,0%,83
indian wedding attire for guests,0,1,0%,83
semi formal wedding guest outfits,0,1,0%,83
black summer dress for wedding,0,1,0%,84
black wedding guest dress long,0,1,0%,84
casual wedding outfits for ladies,0,1,0%,84
outfits for a casual wedding,0,1,0%,84
unique formal wedding guest dresses,0,1,0%,84
dress formal for wedding,0,1,0%,85
formal dresses for a wedding,0,1,0%,85
formal dresses for evening wedding,0,1,0%,85
summer dresses for a wedding guest,0,1,0%,85
black long wedding guest dress,0,1,0%,86
women's semi formal wedding guest dress,0,1,0%,86
casual wedding guest dresses summer,0,1,0%,87
formal gown for wedding guest,0,1,0%,87
cocktail dress for march wedding,0,1,0%,88
formal wedding attire dress,0,1,0%,88
pale pink dresses for wedding guest,0,1,0%,88
semi formal dresses for a wedding,0,1,0%,88
black wedding guest outfits,0,1,0%,89
casual clothes for a wedding,0,1,0%,89
casual dresses wedding guest,0,1,0%,89
best wedding guest dresses,0,1,0%,90
black cocktail dresses for weddings,0,1,0%,90
black elegant dress for wedding,0,1,0%,90
formal dresses for weddings guests,0,1,0%,90
casual dress for wedding guest,0,1,0%,91
casual wedding attire for bride,0,1,0%,91
elegant summer dresses for wedding guests,0,1,0%,91
black dress guest wedding,0,1,0%,92
black dresses wedding,0,1,0%,92
dresses for casual wedding guest,0,1,0%,92
midi cocktail dresses for wedding,0,1,0%,92
semi-formal wedding dress,0,1,0%,92
summer dresses wedding,0,1,0%,92
summer wedding guest dress 2025,0,1,0%,92
casual wedding guest dresses for summer,0,1,0%,93
dress for formal wedding,0,1,0%,93
dresses for a guest at a summer wedding,0,1,0%,93
black wedding attire for women,0,1,0%,94
black wedding guest gowns,0,1,0%,94
dresses for wedding guest summer,0,1,0%,94
dresses to wear to a semi formal wedding,0,1,0%,94
formal dress for wedding guest female,0,1,0%,94
black maxi dress for wedding guest,0,1,0%,95
dresses for formal weddings,0,1,0%,95
dresses for wedding black,0,1,0%,95
formal dresses for a wedding reception,0,1,0%,95
dress casual wedding,0,1,0%,96
dresses for summer weddings 2025,0,1,0%,96
formal wedding guest gowns,0,1,0%,96
summer dresses for wedding guests,0,1,0%,96
womens wedding guest dresses summer,0,1,0%,96
black dress for women wedding,0,1,0%,97
casual dresses for wedding guests,0,1,0%,97
elegant summer wedding guest dresses,0,1,0%,97
cocktail dress for weddings,0,1,0%,98
cocktail dress semi formal wedding,0,1,0%,98
dresses for informal wedding,0,1,0%,98
dresses formal wedding guest,0,1,0%,98
simple black dress for wedding,0,1,0%,98
wedding cocktail attire womens,0,1,0%,98
what is casual dress for a wedding,0,1,0%,98
best dresses for summer wedding guest,0,1,0%,99
cocktail dress evening wedding,0,1,0%,99
summer wedding guest gowns,0,1,0%,99
wedding guest dress black,0,1,0%,99
what to wear casual wedding,0,1,0%,99
women's formal dress for wedding guest,0,1,0%,99
blush colored wedding guest dresses,0,1,0%,100
casual summer dresses for weddings,0,1,0%,100
elegant dresses to wear to a wedding,0,1,0%,100
formal dress for wedding women,0,1,0%,100
formal gowns wedding guest,0,1,0%,100
semi formal wedding guest,0,1,0%,100
women's wedding guest dresses summer,0,1,0%,100
summer cocktail dresses for weddings,0,1,0%,102