Top queries,Clicks,Impressions,CTR,Position
best wedding guest dresses,0,19,0%,73.32
elegant wedding guest dresses,0,4,0%,84.75
indian wedding guest dresses,0,3,0%,63
black cocktail dress for wedding,0,3,0%,74.33
best fall wedding guest dresses 2026 long sleeve but still sexy,0,2,0%,9
pink wedding guest dress,0,2,0%,59
best formal wedding guest dresses,0,2,0%,69
indian wedding dresses for guests,0,2,0%,74.5
black elegant dress for wedding,0,2,0%,83.5
elegant black dresses for wedding guests,0,2,0%,83.5
yellow dresses for wedding guest,0,2,0%,87.5
bright bridesmaid dresses,0,1,0%,7
"is it best 'butter yellow' dresses for a spring 2026 bridesmaid or guest 
look.",0,1,0%,11
dressy casual wedding attire,0,1,0%,55
best black dress for wedding guest with sleeves,0,1,0%,61
casual wedding attire for women,0,1,0%,64
black maxi dress wedding guest,0,1,0%,67
long black wedding guest dresses,0,1,0%,68
best black dresses for wedding guest,0,1,0%,69
smart casual dresses for weddings,0,1,0%,73
casual wedding outfits,0,1,0%,74
pale yellow dress wedding guest,0,1,0%,75
wedding guest dress butter yellow,0,1,0%,75
best dresses for weddings,0,1,0%,76
black cocktail dress wedding,0,1,0%,76
chic wedding guest dresses,0,1,0%,80
top rated wedding guest dresses,0,1,0%,80
classy dresses for weddings,0,1,0%,81
elegant pink dresses for wedding guests,0,1,0%,83
little black wedding guest dress,0,1,0%,85
yellow wedding guest dress,0,1,0%,91
dark color wedding guest dress,0,1,0%,93
guest wedding,0,1,0%,94
wedding guest dress designer,0,1,0%,96
business casual wedding attire female,0,1,0%,98